{
  "run_id": "florence2-1777345685",
  "model_family": "florence2",
  "run_mode": "trainable",
  "manifest_id": "phase1-local",
  "status": "failed",
  "hardware_profile": {
    "gpu_name": "NVIDIA GeForce RTX 4060",
    "gpu_vram_mb": 8188,
    "system_ram_mb": 32466
  },
  "execution_config": {
    "model_variant": "florence2-base",
    "resolution": 640,
    "precision_mode": "fp16",
    "batch_size": 1,
    "seed": 42,
    "dataset_view_id": null,
    "checkpoint_reference": "microsoft/Florence-2-base"
  },
  "metrics": {
    "latency_ms_per_image": 4369.7679,
    "peak_vram_mb": 0
  },
  "failure_examples": [],
  "notes": "Florence-2 model load failed: 'Florence2LanguageConfig' object has no attribute 'forced_bos_token_id'",
  "created_at": "2026-04-28T03:08:05.557834+00:00"
}